{"blocks":[[211,211,211,211,211,211,211,211,211,211,211,211,211,211,211,211],[212,212,212,212,212,212,212,212,212,212,212,212,212,212,212,212],[213,213,213,213,213,213,213,213,213,213,213,213,213,213,213,213],[214,215,216,217,218,219,220,221,222,223,224,225,226,227,228,229],[230,231,232,233,234,235,236,237,238,239,240,241,242,243,244,245]],"coll":[[7,7,7,7],[0,0,0,0],[7,7,7,7],[144,144,144,144],[0,0,112,112]],"id":"TILESET_TEST_HOUSE_1","meanings":{"0":{"perm":"land"},"112":{"mat":"down","perm":"land","warp":"edge"},"144":{"counter":true,"perm":"wall"},"7":{"perm":"wall"}},"tileset":"TILESET_TEST_HOUSE"}