{"blocks":[[0,0,0,0,0,0,0,0,0,0,0,0,0,0,0,0],[1,1,1,1,1,1,1,1,1,1,1,1,1,1,1,1],[2,3,4,5,6,7,8,9,10,11,12,13,14,15,16,17],[20,23,26,29,32,35,38,41,44,47,50,53,56,59,62,65],[66,67,68,69,70,71,72,73,74,75,76,77,78,79,80,81],[82,83,84,85,86,87,88,89,90,91,92,93,94,95,96,97],[98,99,100,101,102,103,104,105,106,107,108,109,110,111,112,113],[114,114,114,114,114,114,114,114,114,114,114,114,114,114,114,114],[115,116,117,118,119,120,121,122,123,124,125,126,127,128,129,130],[131,132,133,134,135,136,137,138,139,140,141,142,143,144,145,146],[147,148,149,150,151,152,153,154,155,156,157,158,159,160,161,162],[163,164,165,166,167,168,169,170,171,172,173,174,175,176,177,178],[179,180,181,182,183,184,185,186,187,188,189,190,191,192,193,194],[195,196,197,198,199,200,201,202,203,204,205,206,207,208,209,210]],"coll":[[7,7,7,7],[0,0,0,0],[24,24,24,24],[41,41,41,41],[7,7,7,7],[7,7,113,7],[18,18,18,18],[7,7,7,7],[0,0,163,163],[7,0,0,0],[178,178,0,0],[36,36,36,36],[0,0,0,0],[7,7,7,7]],"id":"TILESET_TEST_1","meanings":{"0":{"perm":"land"},"113":{"facesDown":true,"perm":"land","warp":"door"},"163":{"ledge":["down"],"perm":"land"},"178":{"neighbor":{"down":"down"},"perm":"land","sides":["up"]},"18":{"cutTree":true,"cuttable":true,"perm":"wall"},"24":{"cuttable":true,"encounter":true,"grass":true,"perm":"land"},"36":{"perm":"water","whirlpool":true},"41":{"encounter":true,"perm":"water"},"7":{"perm":"wall"}},"roof":"ROOF_TEST","tileset":"TILESET_TEST"}